SubjectArea,Subject,Band,Term,Definition
HASS,HASS,Foundation to Year 6,annotated timeline,"Events represented chronologically on a timeline including dates and a written, visual or multimodal summary of each event."
HASS,HASS,Foundation to Year 6,Anzac Day,"An annual day of remembrance in Australia and New Zealand for Australian and New Zealand Army Corps who fought at Gallipoli, Turkey, in the First World War, or served in conflicts and peacekeeping since then."
HASS,HASS,Foundation to Year 6,Apology to the Stolen Generations (the),"A formal apology given to members of the Stolen Generations in 2008 by the Prime Minister on behalf of the Australian Parliament, and between 1997 and 1999 by all state and territory parliaments."
HASS,HASS,Foundation to Year 6,argument,A claim justified with reference to evidence.
HASS,HASS,Foundation to Year 6,artefact,"An object made or changed by humans for their use (such as a stone tool, metal sword, letter or plastic toy) that gives insight into how people lived or is of historical interest."
HASS,HASS,Foundation to Year 6,Asia / Asian,"Geographically, the largest continent, bounded by Europe and the Pacific, Arctic and Indian oceans. It can be described in cultural, religious, historical and language boundaries or commonalities."
HASS,HASS,Foundation to Year 6,Australia Day,An annual public holiday held on 26 January to recognise the arrival of the British in Sydney Cove in 1788.
HASS,HASS,Foundation to Year 6,Australian democracy,"System of government based on the Australian Constitution, a constitutional monarch, liberal democratic values, representation and features of Westminster and Washington parliamentary processes."
HASS,HASS,Foundation to Year 6,Australian Electoral Commission,"The Commonwealth agency providing Australians with an independent electoral service, including education about the electoral process."
HASS,HASS,Foundation to Year 6,belief systems,"A set of principles or tenets which together form the basis of a philosophy, moral code or religion"
HASS,HASS,Foundation to Year 6,British Empire,"Development involving British control of other countries or territories, growing from the 16th century to cover a quarter of the world's land in 1920, with most countries ruling themselves now."
HASS,HASS,Foundation to Year 6,budget,A financial planning tool that gives an overview of income and expenses to plan for and achieve financial objectives.
HASS,HASS,Foundation to Year 6,business,"An organisation or enterprise engaged in producing or buying and selling goods and services, usually for profit."
HASS,HASS,Foundation to Year 6,Cabinet,"Executive body of government, comprising senior ministers and headed by the Prime Minister, Premier or Chief Minister. It makes decisions on policy issues and directs the legislative programme."
HASS,HASS,Foundation to Year 6,capital,"Physical resources such as equipment, machinery and buildings; and human resources such as intellectual property and knowledge used to produce goods and services (e.g. a farmer uses a harvester)."
HASS,HASS,Foundation to Year 6,cartographic conventions,"Practises guiding the making of maps (e.g. inclusion of title, border, legend, scale and north point)."
HASS,HASS,Foundation to Year 6,characteristics of a place,"Tangible or intangible environmental and human characteristics that can be described to identify, classify or give meaning to the uniqueness of a place (e.g. location, topography, scenic quality)."
HASS,HASS,Foundation to Year 6,citizen,An individual who has formal membership of a political community (e.g. a nation) and who is given privileges (e.g. voting in elections or a referendum) and has responsibilities (e.g. jury duty).
HASS,HASS,Foundation to Year 6,citizenship,"The legal status of full membership of a nation acquired by birth or application with civil (rights, responsibilities), political (participation, representation) and social (contribution) commitments."
HASS,HASS,Foundation to Year 6,civic goal,"A shared goal that members of a community have and work together on voluntarily at a local, regional or global scale."
HASS,HASS,Foundation to Year 6,civic life,"Participation in civic, political, legal or community affairs (e.g. investigating an issue, voting in an election, expressing an opinion or volunteering for an environmental group)."
HASS,HASS,Foundation to Year 6,civics,"Rights and responsibilities of citizens, and the organisation and working of a society's political and legal systems (e.g. political and social heritage, shared values or democratic processes)."
HASS,HASS,Foundation to Year 6,climate,"The long-term average (minimum 30 years) of weather conditions at a place, classified into distinctive types (e.g. tropical, dry, temperate, polar, Mediterranean)."
HASS,HASS,Foundation to Year 6,colonisation,"The act of setting up a colony away from one’s place of origin. With humans, it can be seen negatively because it tends to involve an invading culture taking control over an indigenous population."
HASS,HASS,Foundation to Year 6,colony / colonies,"A country, territory or area settled or controlled by a foreign government through its political, legal and economic systems."
HASS,HASS,Foundation to Year 6,constitution,Fundamental principles that govern an organisation or a nation (e.g. the Commonwealth of Australia Constitution Act (1900) sets out the basic rules or specific powers for the government of Australia).
HASS,HASS,Foundation to Year 6,constitutional monarchy,A form of government where a monarch is head of state and whose role (e.g. formal or ceremonial) and powers (e.g. issuing a writ for an election) are defined in the nation's constitution.
HASS,HASS,Foundation to Year 6,consumer,A person or group that purchases or uses goods and services produced in an economy.
HASS,HASS,Foundation to Year 6,consumer and financial choices,"Ability to make informed decisions about strategies to manage finances in consumer and financial contexts considering consequences (e.g. on self, others, sense of security or future options)."
HASS,HASS,Foundation to Year 6,consumer and financial decisions,"Ability to make informed choices about strategies to manage finances in consumer and financial contexts considering consequences (e.g. on self, others, sense of security or future options)."
HASS,HASS,Foundation to Year 6,coordinates,A set of values that define the position of a point or an object in a space. The coordinate system being used will govern the nature of the coordinates.
HASS,HASS,Foundation to Year 6,Country/Place,"Spaces mapped out that individuals or groups of First Nations Peoples of Australia occupy and regard as their own and having varying degrees of spirituality including lands, waters and sky."
HASS,HASS,Foundation to Year 6,court,"A key institution or forum within Australia's legal system where legally enforceable judgements are made in civil and criminal cases, presided over by judge/s or a magistrate."
HASS,HASS,Foundation to Year 6,cultural connections,"Interrelationships between people and their community locally and globally; influences how people live, understand the impact they have on each other, and make sense of their identity and belonging."
HASS,HASS,Foundation to Year 6,custodial responsibility,"The responsibility and obligation for caring for Country/Place and management of land, sea, sky and waterways based on the values and beliefs of First Nations Australian communities."
HASS,HASS,Foundation to Year 6,data,A general term for a set of observations or measurements collected during an investigation. Primary data is collected by the user; secondary data is collected by others.
HASS,HASS,Foundation to Year 6,democracies (Western),"Forms of government in nations such as Australia, New Zealand and the United Kingdom where elected representatives make decisions on behalf of a nation's people and are guided by its constitution."
HASS,HASS,Foundation to Year 6,democracy (representative),A system of government in which electors select representatives for their community or region to represent them in parliament to make decisions or laws on their behalf.
HASS,HASS,Foundation to Year 6,democratic system of government,"A system of government characterised by power being held by the people either directly or indirectly, representatives elected to parliament, protection of human rights and recognition of freedoms."
HASS,HASS,Foundation to Year 6,digital tools,"Digital hardware, software, platforms and resources used to develop and communicate learning, ideas and information."
HASS,HASS,Foundation to Year 6,diversity,"The mix of people in a group or society; i.e. differences in factors such as age, abilities, culture and religion and/or in how people identify in relation to factors such as gender and sexuality."
HASS,HASS,Foundation to Year 6,economy,"A process or system which coordinates resource allocation for the production, distribution and consumption of goods and services within and across countries."
HASS,HASS,Foundation to Year 6,ecosystem,"A functioning unit of the environment defined by a complex set of relationships among its living organisms and its non-living components, where all organisms and components are interdependent."
HASS,HASS,Foundation to Year 6,election,An agreed voting process for citizens to express a preference for a candidate to represent their community or region. In Australia elections are administered by the Australian Electoral Commission.
HASS,HASS,Foundation to Year 6,elector,A citizen who has the right to participate in an election and chooses to do so.
HASS,HASS,Foundation to Year 6,empire,"A political or economic unit or collection of states ruled over or controlled by a single monarch, or emperor or empress, or a sovereign state, through political, legal and economic systems."
HASS,HASS,Foundation to Year 6,environmental resource,"A valuable or useful material; characterised as renewable (used repeatedly and not depleted), non-renewable (after use cannot be replenished) or continuous (availability unaffected by use)."
HASS,HASS,Foundation to Year 6,evaluative language,"Positive or negative language that judges the worth of something. It includes language to express feelings and opinions; make judgements; and assess quality of objects, ideas and features of texts."
HASS,HASS,Foundation to Year 6,Executive,"In the context of Australia, the Prime Minister and ministers, who report to parliament, oversee the implementation of policies and the administration of law which is undertaken by public servants."
HASS,HASS,Foundation to Year 6,features of a place,"Visible elements of a place; classified as natural (e.g. rivers), managed (e.g. parks, farms) and constructed or built (e.g. home, a city)."
HASS,HASS,Foundation to Year 6,federalism,A system of government in which powers and responsibilities are divided between a national government and separate governments in states or territories.
HASS,HASS,Foundation to Year 6,Federation (Australia's),The process by which 6 self-governing British colonies came together as states in a unified country known as the Commonwealth of Australia.
HASS,HASS,Foundation to Year 6,fieldwork,"Active and firsthand collection, examination, interpretation and analysis of materials in relation to geographical questions; often conducted from outside the classroom at a local scale."
HASS,HASS,Foundation to Year 6,geographical diversity,"The different range of environments and varied ways of living in a region, which can be influenced by a range of factors, e.g. climate, topography, beliefs, social structures, culture."
HASS,HASS,Foundation to Year 6,geographical division,"Divisions of Earth's surface based on human-defined scales (e.g. local, state or territory, national, regional, global)."
HASS,HASS,Foundation to Year 6,geospatial tools,"Tools (software or hardware) enabling collection, storage, mapping, representation and visualisation of the occurrence of geographical phenomena and challenges for analysis of causes and effects."
HASS,HASS,Foundation to Year 6,global citizen,"At a global level, an individual’s rights are defined by the Universal Declaration of Human Rights and responsibilities are interpreted differently (e.g. to care for the environment)."
HASS,HASS,Foundation to Year 6,good,A tangible item that satisfies needs and wants.
HASS,HASS,Foundation to Year 6,government (Australian),"The official title of the Australian Government (or federal government) is the Commonwealth of Australia, as established by the Commonwealth of Australia Constitution Act at the time of Federation."
HASS,HASS,Foundation to Year 6,government (levels of),"Three forms of government in Australia made up of local government, state or territory government and federal government."
HASS,HASS,Foundation to Year 6,Governor­-General,"A representative of a monarch who is the head of state and whose role and powers are defined in a nation’s constitution. In practise, the representative performs constitutional and ceremonial duties."
HASS,HASS,Foundation to Year 6,human rights,"The basic rights and freedoms to which all humans are entitled, often held to include the right to life and liberty, freedom of thought and expression, and equality before the law."
HASS,HASS,Foundation to Year 6,identity,"A person’s conception and expression of their individuality or association with a group; sense of belonging to a culture, state or nation, a region or the world regardless of one's citizenship status."
HASS,HASS,Foundation to Year 6,Industrial Revolution,Development in the 18th and 19th centuries arising from technological innovations that transformed agrarian societies to urban-based societies with industrial manufacturing economies.
HASS,HASS,Foundation to Year 6,intertextual references,"Associations or connections between one text and other texts that may be overt or less explicit. They can take the form of direct quotation, parody, allusion or structural borrowing."
HASS,HASS,Foundation to Year 6,invasion,Entrance as if to take possession or overrun. British colonisation was experienced by First Nations Australians as an invasion that denied their occupation of and connection to Country/Place.
HASS,HASS,Foundation to Year 6,Irish Potato Famine,"An event involving mass starvation of people in Ireland from 1845 until 1852 due to a blight that destroyed potato crops, which led to many survivors migrating, including to the Australian colonies."
HASS,HASS,Foundation to Year 6,justice,The concept that all people have the right to fair treatment and equal access to the benefits of society.
HASS,HASS,Foundation to Year 6,kinship,"A system used to decide how people relate to each other and their roles, responsibilities and duties. A feature of First Nations Australians' social organisation and family relationships."
HASS,HASS,Foundation to Year 6,landform,"An individual surface feature of Earth identified by its shape (e.g. dune, plateau, canyon, beach, plain, hill, river, valley)."
HASS,HASS,Foundation to Year 6,landscape,"The visible appearance of an area, created by a combination of geological, geomorphological, biological and cultural layers that have evolved over time, and as perceived and valued by people."
HASS,HASS,Foundation to Year 6,law,A system of rules that a particular country or community recognises as regulating the actions of its members and which it may enforce by imposing penalties and sanctions.
HASS,HASS,Foundation to Year 6,location,A position or site marked by a distinguishing feature; where a particular point or object exists.
HASS,HASS,Foundation to Year 6,lore,"Orally transmitted beliefs, rules, customs and stories representing complex systems of relationships and laws governing traditional lives and societies of First Nations Australians."
HASS,HASS,Foundation to Year 6,management of spaces,Planned strategic action to maintain or restore spaces.
HASS,HASS,Foundation to Year 6,migration,"Movement of people from living in one defined area to living in another (e.g. internal migration within a country, or international migration between countries)."
HASS,HASS,Foundation to Year 6,multi-faith,"Of a society or organisation characterised by support for, or free activity of, different beliefs and religions."
HASS,HASS,Foundation to Year 6,multicultural,"The belief and policy that Australians live in harmony whatever their cultural background, i.e. acceptance and encouragement of different cultures or cultural identities within the community."
HASS,HASS,Foundation to Year 6,multidimensional data,"Data that has many dimensions and values. The data is structured in many rows and columns and can be modelled and viewed in multiple dimensions, facilitating interpretation."
HASS,HASS,Foundation to Year 6,NAIDOC Week,"An annual event held in July to celebrate the histories, cultures and achievements of First Nations Australians; established by NAIDOC (National Aborigines and Islanders Day Observance Committee)."
HASS,HASS,Foundation to Year 6,National Sorry Day,An annual event held on 26 May to commemorate the Stolen Generations and which marks the anniversary of the tabling of the Bringing Them Home report in the Australian Parliament in 1997.
HASS,HASS,Foundation to Year 6,native title,"Recognition that First Nations Peoples of Australia have rights to and interests in lands and waters, as set out in Australian law, according to their traditional law and customs."
HASS,HASS,Foundation to Year 6,need,"Something that is necessary for survival (e.g. food, water, shelter)."
HASS,HASS,Foundation to Year 6,non-renewable,Of or relating to resources developed by geological processes over time which cannot be replenished quickly and are finite (e.g. mineral deposits and fossil fuels).
HASS,HASS,Foundation to Year 6,origin of source,Analysis of a source to establish who created the source as well as where and when it was produced.
HASS,HASS,Foundation to Year 6,parliament,"An assembly of elected representatives where government is formed, laws are made, government work is examined and the people are represented; it usually comprises a lower house and an upper house."
HASS,HASS,Foundation to Year 6,pictorial map,"A map that represents and visualises features in a landscape without a focus on aerial perspective, scale or other conventions."
HASS,HASS,Foundation to Year 6,pictorial timeline,A timeline made up of images put in chronological order without reference to a timescale.
HASS,HASS,Foundation to Year 6,primary sources,"Objects and documents created or written during the time being investigated (e.g. artefacts; official documents such as treaties; personal documents such as diaries, photographs and film)."
HASS,HASS,Foundation to Year 6,producer,An individual or business involved in production of goods and services.
HASS,HASS,Foundation to Year 6,product,Goods and services.
HASS,HASS,Foundation to Year 6,purpose (of source),Analysis of a source to establish the original reason for its creation.
HASS,HASS,Foundation to Year 6,referendum,A vote held about a change to the Australian Constitution. Any change needs approval from a national majority of electors in states and territories and a majority of electors in a majority of states.
HASS,HASS,Foundation to Year 6,region / regional,An area of the world sharing common characteristics (e.g. a geographical region such as South East Queensland or a regional intergovernmental organisation such as the Association of South-East Asian Nations (ASEAN))
HASS,HASS,Foundation to Year 6,register,The level of formality of language used for a particular purpose and audience. Generally variation in register moves from formal (Good morning) to informal (Hi).
HASS,HASS,Foundation to Year 6,renewable,"Of or relating to resources which can be replenished because they are naturally replaced, or can be replaced, such as solar power, animal life and timber."
HASS,HASS,Foundation to Year 6,representatives,"In a democratic system of government, people chosen by electors to represent them in a parliament and to make laws on their behalf."
HASS,HASS,Foundation to Year 6,resources,"The 4 factors of production used to produce goods and services that satisfy needs and wants: land, labour, capital and enterprise."
HASS,HASS,Foundation to Year 6,responsibilities,"Obligations associated with living in a modern democracy (e.g. in Australia this includes paying taxes, jury service, voting at elections)."
HASS,HASS,Foundation to Year 6,rights,Entitlements associated with living in a modern democracy (e.g. people in Australia enjoy the right to vote and freedom of speech).
HASS,HASS,Foundation to Year 6,rule of law,"Established legal principle that all people have equal rights before the law, the administration of the law is impartial, and that judges are independent."
HASS,HASS,Foundation to Year 6,rules,"A set of explicit or understood regulations or principles governing conduct or procedure in a particular area of activity (e.g. school rules, rules of cricket)."
HASS,HASS,Foundation to Year 6,seasonal calendar,A classification of weeks or months of a year into seasons (e.g. in Aboriginal cultures classifications vary and are finely tuned to local climates and availability of food and other resources).
HASS,HASS,Foundation to Year 6,secondary sources,"Accounts created after the time being investigated which refer to primary sources and present an interpretation (e.g. writings of historians, encyclopaedias, documentaries, textbooks and websites)."
HASS,HASS,Foundation to Year 6,sector,The 3 fields that organise industry. The primary sector produces goods that are natural resources (e.g. agriculture); secondary sector converts primary goods (e.g. manufacture); tertiary sector provides services.
HASS,HASS,Foundation to Year 6,separation of powers,"Doctrine that the 3 arms of government – the executive, the legislature (parliament) and the judiciary – are separate and independent, with powers that act as a check and balance on each other."
HASS,HASS,Foundation to Year 6,service,"A intangible product that satisfies needs and wants (e.g. education, communication, transportation, retail, recreation services)."
HASS,HASS,Foundation to Year 6,settlement,"A place where people live, with types of settlements ranging in size from a single dwelling in a rural or remote area to a city."
HASS,HASS,Foundation to Year 6,settlement pattern,"Spatial distribution of human settlement types, with smaller types typically forming patterns around larger ones (e.g. isolated dwellings, villages, towns, regional centres, large cities)."
HASS,HASS,Foundation to Year 6,social organisation,"Pattern of social relationships, norms, roles and institutions characteristic of a particular society or group within a society."
HASS,HASS,Foundation to Year 6,Stolen Generations (the),A name given to the generations of Aboriginal children removed from their families in the 20th century as a result of the policies of Australian and state and territory governments.
HASS,HASS,Foundation to Year 6,system of law,"Laws, processes for making those laws, and judicial systems that ensure laws are followed and enforced by members of countries or communities."
HASS,HASS,Foundation to Year 6,terra nullius,A concept in international law meaning 'a territory belonging to no-one' or 'over which no­one claims ownership'. The concept has been used to justify the colonisation of Australia.
HASS,HASS,Foundation to Year 6,trade,The import (buying) and export (selling) of goods and services in the economy.
HASS,HASS,Foundation to Year 6,traditional owners,The original owners of a particular region based on their traditional and cultural associations with the land and who have ongoing traditional and cultural connections to that Country/Place.
HASS,HASS,Foundation to Year 6,types of resources,"Natural or land (e.g. water, coal, wheat); human or labour (e.g. workers, business owners, volunteers); capital (e.g. tools, machines, technologies) and enterprise (e.g. entrepreneurial behaviours)."
HASS,HASS,Foundation to Year 6,unscaled timeline,A timeline that shows events in chronological order but without a scale for the distance in time between the events represented.
HASS,HASS,Foundation to Year 6,urban place,"A developed place where people live, which has a density of human structures and often high population density (e.g. towns, cities and suburbs)."
HASS,HASS,Foundation to Year 6,validity,The state of being logically or factually sound.
HASS,HASS,Foundation to Year 6,values,Ideas and beliefs specific to individuals and groups.
HASS,HASS,Foundation to Year 6,vegetation,"Plant life or plant cover arranged across Earth's surface (e.g. trees, grasses or mosses)."
HASS,HASS,Foundation to Year 6,voting,A way of formally expressing choice on a proposed resolution of an issue in a parliament or electing a representative or candidate to office.
HASS,HASS,Foundation to Year 6,voting system,"The procedure used to count votes cast in an election, including the count of first preference votes or the distribution of second and other preferences (e.g. preferential or first past the post)."
HASS,HASS,Foundation to Year 6,want,"A good or service that is desired to provide satisfaction to a user, but which is not necessary for survival or to meet the basic standard of living in a community."
HASS,HASS,Foundation to Year 6,water resource,"A natural resource existing in different forms (e.g. freshwater, groundwater, precipitation), irregularly distributed and useful to people and their activities (e.g. agriculture, industry, household)."
HASS,HASS,Foundation to Year 6,weather,"The state of the atmosphere at a particular place and time, such as wind, temperature, atmospheric pressure, humidity, precipitation and cloudiness."
