SubjectArea,Subject,Band,Term,Definition
Mathematics,Mathematics,Foundation to Year 10,gradient,"The slope of a line. It is calculated as the gradient of a line segment it contains. The gradient (m) of the line containing A(x₁,y₁) and B(x₂,y₂)is calculated as m=(y2-y1)/(x2- x1)."
Mathematics,Mathematics,Foundation to Year 10,grid coordinate system,A system for referencing location within a space using labelled horizontal and vertical grid lines. Locations are defined using a set of coordinates which indicate points in the plane where 2 grid lines meet.
Mathematics,Mathematics,Foundation to Year 10,grid reference,"A way of identifying a region on a map. Coordinates and grid lines are used to refer to specific features or locations, e.g. in the map shown, the school is located at the grid reference C4."
Mathematics,Mathematics,Foundation to Year 10,grouping,"A process of partitioning a set into subsets according to a given criterion, e.g. a class of students according to eye colour. Equal grouping means each subset has the same number of elements."
Mathematics,Mathematics,Foundation to Year 10,growing pattern,"A pattern where each term is either an increase or a decrease on the previous term. Change from term to term is predictable if the pattern is growing additively, multiplicatively or exponentially."
Mathematics,Mathematics,Foundation to Year 10,growth,"A measure of the increase in value of the dependent variable of a function as the value of the independent variable increases, e.g. the length of a spring when weights are added."
Mathematics,Mathematics,Foundation to Year 10,guided statistical investigation,"A teacher-led, scaffolded approach to the statistical investigation process including collecting, representing and analysing data, interpreting and communicating results."
Mathematics,Mathematics,Foundation to Year 10,histogram,A statistical graph for displaying the frequency distribution of continuous data. It is also a graphical representation of the information contained in a frequency table.
Mathematics,Mathematics,Foundation to Year 10,improper fraction,"A fraction where the numerator is greater than or equal to the denominator, e.g. 7/5 is an improper fraction, where as 5/7 is a proper fraction."
Mathematics,Mathematics,Foundation to Year 10,inequality,"A mathematical expression containing the terms ‘less than’, ‘less than or equal to’, ‘greater than’, or ‘greater than or equal to’ and their respective symbolic representations <, ≤, > and ≥."
Mathematics,Mathematics,Foundation to Year 10,inference (statistics),"The process for determining consequences or conclusions based on assumptions, evidence and reasoning."
Mathematics,Mathematics,Foundation to Year 10,informal units,"Units whose values are decided on in a given context, e.g. the use of a pace to measure distance (non-uniform unit); the use of paperclips to measure length (uniform unit)."
Mathematics,Mathematics,Foundation to Year 10,integer,"An element of the infinite set of numbers Z = {... -3, -2, -1, 0, 1, 2, 3 ...}."
Mathematics,Mathematics,Foundation to Year 10,interval(s),"A continuous subset of the real number line, e.g. ‘the set of all real numbers greater than or equal to 10’."
Mathematics,Mathematics,Foundation to Year 10,inverse operation,"An operation in arithmetic which undoes the effect of another operation. Multiplication and division are inverse operations, as are addition and subtraction."
Mathematics,Mathematics,Foundation to Year 10,irrational number,"A number that cannot be expressed as a fraction in the form m/n, where m and n are integers and n is non-zero. The decimal expansions of such numbers are infinite and non-recurring."
Mathematics,Mathematics,Foundation to Year 10,irregular object,An object that has faces of varying shapes. Contrast with a regular object such as a cube.
Mathematics,Mathematics,Foundation to Year 10,irregular shape,A shape with sides of varying lengths. Contrast with a regular shape such as a rhombus or equilateral triangle.
Mathematics,Mathematics,Foundation to Year 10,kinship,"A system used to decide how people relate to each other and their roles, responsibilities and duties. A feature of First Nations Australians' social organisation and family relationships."
Mathematics,Mathematics,Foundation to Year 10,line,A model of what is perceived visually as straight. It has one dimension and extends indefinitely in the plane.
Mathematics,Mathematics,Foundation to Year 10,line graphs,"Graphs that represent the changing relationship between 2 variables. They use lines to connect individual data points, and are generally used to show how something changes over time."
Mathematics,Mathematics,Foundation to Year 10,line segment (interval),"Let Aand B be 2 distinct points on a line, then the part of the line between and including A and B is a line segment."
Mathematics,Mathematics,Foundation to Year 10,line symmetry,A line in which a shape is symmetrical such that if you were to fold the shape about this line it would map onto itself exactly.
Mathematics,Mathematics,Foundation to Year 10,linear equations,"Equations involving linear expressions. The general form of a linear equation in one variable is ax+b=c where a, b and c are constants."
Mathematics,Mathematics,Foundation to Year 10,linear expression,"An expression involving only variables to the power 1, and constants, e.g.
2x+3, 180(n-2), 4x-5y."
Mathematics,Mathematics,Foundation to Year 10,linear functions,A function which when graphed on a Cartesian plane produces a straight line. It can be reduced to the general form y=mx+b.
Mathematics,Mathematics,Foundation to Year 10,linear inequalities,"Inequalities that involve linear expressions and contain one of the inequality signs: either < , > , ≤ or ≥."
Mathematics,Mathematics,Foundation to Year 10,logarithmic scales,Scales where successive endpoint values of intervals increase by a constant factor (multiplicatively). Contrast with linear scales in which the increase is a constant amount.
Mathematics,Mathematics,Foundation to Year 10,mass,The measure for how much matter an object contains. The SI unit for mass is the kilogram (kg).
Mathematics,Mathematics,Foundation to Year 10,mathematical modelling,"A mathematical process involving the identification of a real-world problem, formulating and finding a solution to the problem mathematically using knowledge and understanding of mathematical concepts, structures and relationships, interpreting and communicating the mathematical solution(s) in terms of the situation. As students mathematical modelling skills become more sophisticated they begin to consider assumptions, choose variables, justify decisions and evaluate the effectiveness of the model."
Mathematics,Mathematics,Foundation to Year 10,mean,The sum of values in a data set divided by the total number of values in the data set. Also called the average.
Mathematics,Mathematics,Foundation to Year 10,measure,"A record of the magnitude of an attribute (such as weight, length, duration and likelihood) associated with an object or event."
Mathematics,Mathematics,Foundation to Year 10,measure of central tendency,"A statistic that is used to summarise a data set. There are 3 common measures of centre for a data set: mode, median and mean."
Mathematics,Mathematics,Foundation to Year 10,measure of turn,A measurement of rotation from an initial starting position. A turn can be a fraction of a circle (quarter turn) or complete rotation (revolution). It can be directional (clockwise or anti-clockwise).
Mathematics,Mathematics,Foundation to Year 10,median,The value in a set of ordered data that divides the data into 2 equal parts. It is often called the ‘middle value’.
Mathematics,Mathematics,Foundation to Year 10,mixed numeral,"A form of representation of a rational number (also called a mixed fraction or mixed number) composed of an integer and a proper fraction, i.e. a fraction with a smaller numerator than denominator, e.g.2⅗."
Mathematics,Mathematics,Foundation to Year 10,mode,"The most frequently occurring value in a set of data. There can be more than one mode. When there are 2 modes, the data set is said to be bimodal."
Mathematics,Mathematics,Foundation to Year 10,modelling,"Using mathematical concepts, structures and relationships to describe and characterise, or model, a situation in a way that captures its essential features."
Mathematics,Mathematics,Foundation to Year 10,multiples,A multiple of a number is the product of that number and an integer. A multiple of a real number x is any number that is a product of x and an integer.
Mathematics,Mathematics,Foundation to Year 10,multiplication facts,"The results associated with the products of pairs of natural numbers from 0 to 9, associated with reasons. They are foundational to arithmetic."
Mathematics,Mathematics,Foundation to Year 10,multiplicative,"Problems or contexts that involve multiplication or division, e.g. calculating the number of seats in a theatre that has 30 rows of 24 seats."
Mathematics,Mathematics,Foundation to Year 10,natural numbers,"The set N = {0, 1, 2, 3 …} or N = {1, 2, 3 …} depending on whether counting is started at 0 or 1. The elements of N are also called the counting numbers, used to count the number of elements in finite sets."
Mathematics,Mathematics,Foundation to Year 10,nets,"Plane figures that can be folded to form a polyhedron. More specifically, 2-dimensional representations comprising joined shapes (the faces) that can be folded (along edges) to form the object."
Mathematics,Mathematics,Foundation to Year 10,network,"A set of points (vertices or nodes) some of which are joined by lines or curves (edges) which sometimes enclose regions (faces), e.g. road networks, a family tree or the edges lining a tennis court."
Mathematics,Mathematics,Foundation to Year 10,number line,A line that gives a pictorial representation of real numbers.
Mathematics,Mathematics,Foundation to Year 10,number sentence,"A statement of equality or inequality using numbers, operations and common symbols,
e.g. 8+5=13 and 16 –☐= 10"
Mathematics,Mathematics,Foundation to Year 10,numeral,"The designation of a number in a given language, e.g. the number ‘three’ is designated by the Hindu-Arabic numeral 3, the Roman numeral III, and the Chinese numeral 三."
Mathematics,Mathematics,Foundation to Year 10,numerical data,"Data associated with a numerical variable. It can be discrete or continuous, e.g. number of siblings in a family or heights of students in the class."
Mathematics,Mathematics,Foundation to Year 10,numerical variables,"Variables with values that are numbers, and for which measuring and arithmetic processes such as adding and subtracting, or calculating an average, make sense."
Mathematics,Mathematics,Foundation to Year 10,object,"A solid or 3-dimensional skeletal representation composed of a number of faces, edges, vertices or closed surfaces, such as a prism, pyramid, cylinder or sphere. The term 3-dimensional shape is also used."
Mathematics,Mathematics,Foundation to Year 10,obtuse angle,"An angle that measures between 90 and 180 degrees, i.e. between one and 2 right angles."
Mathematics,Mathematics,Foundation to Year 10,odd number,"An integer that is not divisible by 2. The odd numbers are {… -5, -3,-1, 1, 3, 5, …}."
Mathematics,Mathematics,Foundation to Year 10,online tools,"Digital hardware, software, platforms and resources that are connected and support communications between users. Examples of online tools include websites for online shopping and fitness apps."
Mathematics,Mathematics,Foundation to Year 10,operation,"The process of combining numbers or expressions. Operations are arithmetic – addition, subtraction, multiplication and division – and also include exponentiation and substitution."
Mathematics,Mathematics,Foundation to Year 10,order of operations,"A set of conventions for evaluating expressions involving several operations. Operations in brackets are first, followed by exponents, multiplication/division, then addition/subtraction left to right."
Mathematics,Mathematics,Foundation to Year 10,ordinal categorical data,"Categorical data that has a ranking or order such as Likert scales, clothing sizes, placegetters in a race."
Mathematics,Mathematics,Foundation to Year 10,outlier,A data value that appears to stand out from the other members of the data set by being unusually high or low.
Mathematics,Mathematics,Foundation to Year 10,parallel lines,"Two lines L and M in a plane that have no point of intersection in that plane, written L || M."
Mathematics,Mathematics,Foundation to Year 10,parallelogram,A quadrilateral in which opposite sides are parallel and equal in length. The quadrilateral ABCD shown is a parallelogram because BA || CD and AD || BC.
Mathematics,Mathematics,Foundation to Year 10,parameters,A factor for which a specific value defines a condition or constraint for a function or relation.
Mathematics,Mathematics,Foundation to Year 10,part-part-whole reasoning,"A model used to recognise relationships between a whole number and its parts, e.g. 7=5+2 or 7=4+3."
Mathematics,Mathematics,Foundation to Year 10,partition numbers,"Separating numbers additively or multiplicatively into 2 or more parts, e.g. 10 is 8+2,
8 is 3+3+2; 12 divided into 6 equal parts of 2, 12=6×2, 12÷6=2, 12=3×4, 12÷3=4."
Mathematics,Mathematics,Foundation to Year 10,partitioning,The ability to think about numbers as made up of 2 or more parts. Numbers can be partitioned into standard or non-standard place value partitions such as 248 as 200+40+8 or 62 as 50+10+2.
Mathematics,Mathematics,Foundation to Year 10,percentage,A ratio to 100 or a fraction whose denominator is 100.
Mathematics,Mathematics,Foundation to Year 10,perfect square,"A number that is the square of an integer, e.g. 169is a perfect square as 13²=169. Perfect squares can also be represented pictorially."
Mathematics,Mathematics,Foundation to Year 10,perimeter,The total length of the boundary of a plane figure or space.
Mathematics,Mathematics,Foundation to Year 10,perpendicular,"Two lines, rays, line segments, vectors, planes or other objects that intersect at a 90° angle (a right angle) are considered perpendicular."
Mathematics,Mathematics,Foundation to Year 10,pi (π),The ratio of the circumference of any circle to its diametre. It is denoted by the Greek letter π (pi). Approximate values are 3.14 or 22/7.
Mathematics,Mathematics,Foundation to Year 10,picture graph (pictographs),A statistical graph for organising and displaying categorical data.
Mathematics,Mathematics,Foundation to Year 10,place value,"The value of a digit as determined by its position in a number relative to the ones (or units) place. For integers, the ones place is occupied by the rightmost digit in the number."
Mathematics,Mathematics,Foundation to Year 10,planar graph,A connected graph that is drawn within a plane whose edges do not cross.
Mathematics,Mathematics,Foundation to Year 10,platonic solids,"Three-dimensional, convex and regular objects that have polygonal faces. The 5 platonic solids are the tetrahedron, cube, octahedron, dodecahedron and icosahedron."
Mathematics,Mathematics,Foundation to Year 10,point,"Representation of a location in space that has zero dimensions. Lines, curves, shapes, surfaces and objects are constructed from sets of points. Points in the Cartesian plane are specified by coordinates."
Mathematics,Mathematics,Foundation to Year 10,polyhedra,"Three-dimensional objects whose faces are adjacent polygons. A convex polyhedron is a finite region bounded by planes, in the sense that the region lies entirely on one side of the plane."
Mathematics,Mathematics,Foundation to Year 10,population,"The complete set of individuals, objects, places, etc. that we want information about. A census collects information about the whole population."
Mathematics,Mathematics,Foundation to Year 10,prime number,A natural number that is greater than 1 and its only factors are 1 and itself.
Mathematics,Mathematics,Foundation to Year 10,prism,"A convex polyhedron that has 2 congruent and parallel polygonal faces; all its other faces are parallelograms. It is named according to these 2 congruent faces, e.g. a triangular prism."
Mathematics,Mathematics,Foundation to Year 10,probability,"The chance of something happening shown on a scale from 0 and 1 (inclusive), e.g. the probability that a fair coin toss will come up ‘heads’ is 0.5."
Mathematics,Mathematics,Foundation to Year 10,product,The result of multiplying together 2 or more numbers or algebraic expressions.
Mathematics,Mathematics,Foundation to Year 10,proof,A mathematical argument that demonstrates whether a proposition is true. A mathematical statement which has been proved is called a theorem.
Mathematics,Mathematics,Foundation to Year 10,proportion,"A constant ratio between corresponding elements of 2 sets, e.g. the circumference and diametre of a circle are in proportion as their ratio is the constant π (pi)."
Mathematics,Mathematics,Foundation to Year 10,Pythagoras's theorem,"The square of the length of the hypotenuse, c, of a right-angled triangle equals the sum of the squares of the lengths of the other 2 sides, a and b, such that c²=a²+b²."
Mathematics,Mathematics,Foundation to Year 10,quadratic equation,"A quadratic expression that has a particular value. The general quadratic equation in one variable is ax²+bx+c=0, for constants a, b, c and where a≠0."
Mathematics,Mathematics,Foundation to Year 10,quadratic expression,"An expression that contains one or more of the terms in which the variable is raised to the second power, but no variable is raised to a higher power. Its general form is ax²+bx+c, where a≠0."
Mathematics,Mathematics,Foundation to Year 10,quadratic function,A function in which the rule is a quadratic expression. When graphed in the Cartesian plane it produces a parabola and algebraically it can be represented in the form y=ax²+bx+c where a≠0.
Mathematics,Mathematics,Foundation to Year 10,quadrilateral,"A four-sided polygon. Examples include square (a regular quadrilateral, all sides and angles equal), rectangle, kite and trapezium."
Mathematics,Mathematics,Foundation to Year 10,quotient,The result of dividing one number or algebraic expression by another.
Mathematics,Mathematics,Foundation to Year 10,radius,The distance from the centre to the circumference of a circle.
Mathematics,Mathematics,Foundation to Year 10,random sample,"A subset of the population chosen such that every element of the population has an equal chance of being selected; i.e. their selection is governed by chance, e.g. by using a random number generator."
Mathematics,Mathematics,Foundation to Year 10,random variable,A function that assigns real numbers to random events.
Mathematics,Mathematics,Foundation to Year 10,range,"A set of different things of the same general type, e.g. different representations of the same fraction or a variety of strategies for solving problems involving the basic operations.
Statistics: the difference between the largest and smallest numerical values in a data set. It can be used as a measure of spread in a data set. It is sensitive to outliers and should be interpreted with care."
Mathematics,Mathematics,Foundation to Year 10,rate,"A comparison of 2 quantities measured in different units, e.g. the rate of distance to time, known as speed, because distance and time are measured in different units (such as kilometres and hours)."
Mathematics,Mathematics,Foundation to Year 10,ratio,"A comparison of magnitudes of sets, quantities of the same kind or algebraic expressions. It is often used as a comparison a∶b of the size of 2 (or more) quantities relative to each other."
Mathematics,Mathematics,Foundation to Year 10,rational number,"An element of the infinite set of numbers Q= {m/n, wherem and n are integers and n ≠ zero}. It may be expressed in decimal form, e.g. ⅛=0.125and 4/9=0.444…"
Mathematics,Mathematics,Foundation to Year 10,real number line,The representation of real numbers using the infinite set of points on a continuous line.
Mathematics,Mathematics,Foundation to Year 10,real numbers,"The numbers generally used in mathematics, scientific work and everyday life. They are any of the elements of the infinite set R, which includes all the rational numbers and irrational numbers."
Mathematics,Mathematics,Foundation to Year 10,reasonableness (calculation),"Checking the results of calculations or operations to see if they are reasonable in the context, e.g. the sum of 2 odd natural numbers must be an even number."
Mathematics,Mathematics,Foundation to Year 10,rectangle,A quadrilateral in which all angles are right angles.
Mathematics,Mathematics,Foundation to Year 10,recurring decimal,"A decimal expansion of a number that contains a finite sequence of digits that repeats indefinitely, such as 34.271271271 ... The repeating sequence is often designated by a bar over it, such as 34.271."
Mathematics,Mathematics,Foundation to Year 10,reflection,A transformation where each point of a shape is mirrored to a position the same distance from an axis of symmetry.
Mathematics,Mathematics,Foundation to Year 10,reflex angle,"An angle that measures between 180 and 360 degrees, i.e. between 2 and 4 right angles."
Mathematics,Mathematics,Foundation to Year 10,regular shape,"A shape that has all sides of equal length, and all interior angles equal."
Mathematics,Mathematics,Foundation to Year 10,related denominators,One of the denominators is a multiple of the other denominator of a pair of fractions.
Mathematics,Mathematics,Foundation to Year 10,relation,"A correspondence (map) between the elements of 2 sets, e.g. ‘favourite colour’ related to the set of students in a class (the domain) and the set of colours (the co-domain)."
Mathematics,Mathematics,Foundation to Year 10,rename,"To express a number according to the relationship between the place value powers of 10, e.g. 263 can be renamed 2 hundreds and 63 ones or 1 hundred, 16 tens and 3 ones."
Mathematics,Mathematics,Foundation to Year 10,repeated addition,"Adding the same number several times, e.g. 3+3+3+3=4×3=12. A strategy sometimes used for multiplication."
Mathematics,Mathematics,Foundation to Year 10,repeating pattern,"A pattern where there is an identifiable repeating unit such as beads arranged in a sequence of red, green, blue, red, green, blue …; days of the week or months of the year."
Mathematics,Mathematics,Foundation to Year 10,revolution,A complete turn around a point.
Mathematics,Mathematics,Foundation to Year 10,right angle,"An angle formed by a quarter turn of a revolution. It is equal to 90 degrees. If 2 lines are at a right angle, they may also be referred to as being perpendicular."
Mathematics,Mathematics,Foundation to Year 10,right prism,Convex polyhedra that have 2 congruent and parallel faces and all remaining faces are congruent rectangles.
Mathematics,Mathematics,Foundation to Year 10,rotation,"A transformation where each point in the plane is rotated through a given angle about a fixed point in the plane (the point or centre of rotation). For example, the point A is rotated 120° clockwise and 60° anti-clockwise."
Mathematics,Mathematics,Foundation to Year 10,rotational symmetry,"A quality of some shapes and objects to appear the same when turned around their centre for less than a full turn, e.g. a square has quarter-turn rotational symmetry."
Mathematics,Mathematics,Foundation to Year 10,rounding,"The process for approximating a value that lies between 2 known values. It is used to specify a number correct to a given accuracy, e.g. 4.027 becomes 4.03 when rounded to 2 decimal places."
Mathematics,Mathematics,Foundation to Year 10,sample,"A subset of a population used to estimate characteristics of the population, e.g. a randomly selected group of 8 year olds (sample) selected to estimate the height of 8 year olds in Australia (population)."
Mathematics,Mathematics,Foundation to Year 10,sample space,"The set of all possible outcomes of a chance experiment, e.g. the set of outcomes (also called sample points) from tossing 2 heads is {HH, HT, TH, TT}, where H represents a ‘head’ and T a ‘tail’."
Mathematics,Mathematics,Foundation to Year 10,sampling,A process by which a subset of a population is selected for the purposes of data analysis. This subset is called a sample.
Mathematics,Mathematics,Foundation to Year 10,scale,"Specification of proportion between 2 measures, e.g. a model of a house may be made on a 1:10 scale of length; on a graph, each interval of the vertical axis corresponds to a given value."
Mathematics,Mathematics,Foundation to Year 10,scatter plot,A visual representation of bivariate numerical data using the position of each dot on the horizontal and vertical axis to indicate the numerical values for an individual data point. Scatter plots are used to observe relationships between variables.
Mathematics,Mathematics,Foundation to Year 10,scientific notation,"A way of writing numbers that are too big or too small to be written in an accessible way. It uses powers of 10, e.g. the scientific notation for 34 590 is 3.459 ×10⁴."
Mathematics,Mathematics,Foundation to Year 10,set,"A collection of objects or elements, usually specified by listing its elements, e.g. {1, 2, 3, 4}; by describing it in words, e.g. ‘the set of primes’; or by using a rule such as {( x, y ): y= 2x+1, x∈N }."
Mathematics,Mathematics,Foundation to Year 10,shape (Space),"A geometric figure in 2-dimensional space, such as a freehand closed curve, a triangle or square. It can be regular or irregular, simple or complex."
