SubjectArea,Subject,Band,Term,Definition
Mathematics,Mathematics,Foundation to Year 10,shape (statistics),"The form of the visual representation of the distribution of numerical data, which may be symmetrical, skewed or multimodal."
Mathematics,Mathematics,Foundation to Year 10,side-by-side column graph,A type of column graph that can be used to organise and display the data that arises when a group of individuals or things are categorised according to 2 or more criteria.
Mathematics,Mathematics,Foundation to Year 10,simulation,"The process of simulating an event using technology or a device, e.g. if 2 players are equally likely to win a game on past performance, then games could be simulated by successive tossing of a fair coin."
Mathematics,Mathematics,Foundation to Year 10,simulations,"A simulation is a recreation of a random phenomena used to collect probability data using either physical or virtual manipulatives such as spinners, coins and cards or computer generated simulations which can be performed a large number of times."
Mathematics,Mathematics,Foundation to Year 10,sine ratio,"In any right-angled triangle, sinθ=opposite/hypotenuse, where 0<θ<90°."
Mathematics,Mathematics,Foundation to Year 10,skip counting,"Counting from a given starting value using multiples of a fixed natural number, e.g. {2, 4, 6, ...} or {7, 12, 17...}."
Mathematics,Mathematics,Foundation to Year 10,spread,"A statistic that indicates how widely the values of a data set are distributed. Common measures of spread include range, interquartile range, quantiles and percentiles."
Mathematics,Mathematics,Foundation to Year 10,square number,"The result of multiplying a natural number by itself, e.g. 16=4×4=4², and is an element of the set {0, 1, 4, 9, 16, 25 ...}."
Mathematics,Mathematics,Foundation to Year 10,square root,A value that when multiplied by itself gives the original number. The positive square root of a given real number x is the positive real number ysuch that y²=x.
Mathematics,Mathematics,Foundation to Year 10,statistical investigation,"An investigation process involving a chosen context, area of interest or an identified problem scenario, identifying the subjects and variables to be investigated, planning the approach, collecting data, representing, interpreting and analysing the data, making inferences and communicating the results of the investigation in terms of the context."
Mathematics,Mathematics,Foundation to Year 10,stem-and-leaf plot,A method of organising and displaying numerical data in which each data value is split into 2 parts: a ‘stem’ and a ‘leaf’. Stem plots give a visual indication of spread.
Mathematics,Mathematics,Foundation to Year 10,straight angle,The angle formed by 2 opposite rays on a straight line from a common point. A straight angle is also formed by a half turn of ray about its endpoint. It measures 180 degrees.
Mathematics,Mathematics,Foundation to Year 10,subitising,The capacity to visually recognise the size of a small set of objects without counting.
Mathematics,Mathematics,Foundation to Year 10,supplementary angles,Two adjacent angles that form a straight angle and their sum is 180 degrees (a straight angle).
Mathematics,Mathematics,Foundation to Year 10,surface area,The measure of the total area of the surface(s) of a 3-dimensional shape or object.
Mathematics,Mathematics,Foundation to Year 10,survey,"A tool for collecting data that comprises a series of questions, which can be constructed to collect quantitative or qualitative data, numerical or categorical responses."
Mathematics,Mathematics,Foundation to Year 10,tangent ratio,"The ratio of the length of the altitude, a, of a right-angled triangle to the length of its base, b, for a given base angle, theta, θ."
Mathematics,Mathematics,Foundation to Year 10,terminating decimal,"A decimal expansion of a number which has a finite number of non-zero digits, e.g. 3.125."
Mathematics,Mathematics,Foundation to Year 10,tessellation,"A repeated pattern in the plane or on a surface where shapes completely fill all of the space around a given point where their boundaries meet, e.g. a honeycomb is a tessellation using hexagons."
Mathematics,Mathematics,Foundation to Year 10,theorem,A statement which has been derived from given statements using agreed rules of deduction (proof).
Mathematics,Mathematics,Foundation to Year 10,three-dimensional,"An object that has 3 independent dimensions of length, width (breadth) and depth, or a space in which position is specified by 3 independent coordinates."
Mathematics,Mathematics,Foundation to Year 10,three-dimensional coordinate system,"A coordinate system where any point in the space is defined using 3 different dimensions, e.g. longitude, latitude and altitude for locating the position of a drone in the sky."
Mathematics,Mathematics,Foundation to Year 10,time zones,"The 24 divisions of the globe, where each change of 15 degrees longitude corresponds to one hour. As time zones often align with national or regional boundaries this is an approximate relationship."
Mathematics,Mathematics,Foundation to Year 10,transformation,"A map of the plane onto itself. Transformations include dilation (enlargements or compressions), reflections, rotations and translations."
Mathematics,Mathematics,Foundation to Year 10,translation,Shifting a figure in the plane without turning it. Translations can be specified as a combination of a horizontal shift and a vertical shift.
Mathematics,Mathematics,Foundation to Year 10,transversal,A line that intersects 2 other lines obliquely.
Mathematics,Mathematics,Foundation to Year 10,tree diagram,"A diagram consisting of line segments (edges) connected to points (vertices) like the branches of a tree. It shows the relationship between sets, events, or the set of outcomes of a multi-step random experiment."
Mathematics,Mathematics,Foundation to Year 10,trials,"Any repeatable procedures with a well-defined set of possible outcomes, known as the sample space, e.g. for the flipping of a coin the sample space would be {H, T}."
Mathematics,Mathematics,Foundation to Year 10,trigonometric ratios,"Relationships between the angles and sides of right triangles. The 3 basic trigonometric ratios in this curriculum are: sine (sin), cosine (cos) and tangent (tan)."
Mathematics,Mathematics,Foundation to Year 10,two-dimensional,"A shape that has 2 independent dimensions of length and width (breadth) is 2 dimensional, as is a space in which position is specified by 2 independent coordinates, such as the plane."
Mathematics,Mathematics,Foundation to Year 10,two-way tables,A common way of displaying the two-way frequency distribution that arises when a group is categorised according to 2 criteria.
Mathematics,Mathematics,Foundation to Year 10,unit fraction,"A fraction of the form 1/n, where n is a non-zero natural number, such as ½,⅓,¼..."
Mathematics,Mathematics,Foundation to Year 10,unit of repeat,"In a repeating pattern, the pattern sequence that is repeated within the pattern, e.g. 1234 in the pattern 1234123412341234..."
Mathematics,Mathematics,Foundation to Year 10,units,"The basis for counting or measurement or both, e.g. the number 1 is the unit for counting; the metre is the standard unit for measurement of length in the metric system."
Mathematics,Mathematics,Foundation to Year 10,univariate data,"Data relating to measurement of a single variable, e.g. shoe size."
Mathematics,Mathematics,Foundation to Year 10,validate (data),"The process of checking that data to be analysed is reasonable and fit for purpose. This can involve checking for accuracy, clarity, detail, consistency, correctness and completeness."
Mathematics,Mathematics,Foundation to Year 10,variable,"Things that are measurable or observable that are expected to either change over time or between individual observations. They are often designated by symbols, such as n, x and y, to represent members of a set."
Mathematics,Mathematics,Foundation to Year 10,variation in data,"The characteristic that elements of a data set differ, e.g. the maximum temperature recorded at different suburbs of a town on a given day."
Mathematics,Mathematics,Foundation to Year 10,Venn diagrams,"Graphical representations, using several typically overlapping circles, showing elements of sets in relation to properties or attributes. They are drawn for some specified universal set."
Mathematics,Mathematics,Foundation to Year 10,vertically opposite angles,Two pairs of vertically opposite angles formed at the point of intersection of 2 lines in the plane. Vertically opposite angles are equal.
Mathematics,Mathematics,Foundation to Year 10,virtual materials,Dynamic digital representations of physical materials (sometimes called virtual manipulatives).
Mathematics,Mathematics,Foundation to Year 10,visualisations,"Visual formats for organising, representing and summarising data. Also called data displays."
Mathematics,Mathematics,Foundation to Year 10,volume,The amount of space bounded by the surface of an object. It is usually measured in cubic units.
Mathematics,Mathematics,Foundation to Year 10,zero,"The number represented by the numeral or the symbol 0, e.g. the origin on a number line. It also functions as an empty place-holder digit in the decimal expansion of numbers, e.g. 205."
